{"schema_version":1,"init_time":"2026-09-09T00:00:00Z","regime":"realtime","tier":"provisional","init_source":"gfs","truth_source":"gfs_analysis","truth_valid_through":"2026-09-13T06:00:00Z","city":{"id":"buenos-aires","name":"Buenos Aires","lat":-34.6,"lon":-58.38},"leads":[6,12,18,24,30,36,42,48,54,60,66,72,78,84,90,96,102,108,114,120],"valid_times":["2026-09-09T06:00:00Z","2026-09-09T12:00:00Z","2026-09-09T18:00:00Z","2026-09-10T00:00:00Z","2026-09-10T06:00:00Z","2026-09-10T12:00:00Z","2026-09-10T18:00:00Z","2026-09-11T00:00:00Z","2026-09-11T06:00:00Z","2026-09-11T12:00:00Z","2026-09-11T18:00:00Z","2026-09-12T00:00:00Z","2026-09-12T06:00:00Z","2026-09-12T12:00:00Z","2026-09-12T18:00:00Z","2026-09-13T00:00:00Z","2026-09-13T06:00:00Z","2026-09-13T12:00:00Z","2026-09-13T18:00:00Z","2026-09-14T00:00:00Z"],"truth":{"tp06":{"status":"truth_pending","values":null},"t2m":{"status":"ok","values":[284.1,285.43,288.53,287.44,285.47,286.39,290.23,287.42,285.91,286.76,288.96,286.33,283.83,281.91,281.53,281.25,278.4,null,null,null]},"u10m":{"status":"ok","values":[0.3,-1.36,-1.48,-3.41,0.43,-0.66,-2.11,-4.0,-2.77,-2.41,-3.3,-1.43,-2.37,-1.99,-1.56,-2.05,0.05,null,null,null]},"v10m":{"status":"ok","values":[-3.74,-2.41,-2.2,0.07,-2.51,-1.31,-0.41,-0.49,0.24,1.32,1.38,4.95,5.83,7.27,6.54,5.46,5.11,null,null,null]},"z500":{"status":"ok","values":[55476.7,55516.4,55291.2,55296.8,55028.9,55072.3,55009.3,55029.5,54922.1,54915.9,54718.6,54904.4,54948.1,55058.5,55062.7,55148.9,54932.4,null,null,null]},"t850":{"status":"ok","values":[279.15,280.24,279.16,278.5,278.72,278.98,279.51,279.72,279.69,278.74,277.5,276.6,275.66,273.13,272.07,268.0,268.02,null,null,null]},"msl":{"status":"ok","values":[101856.4,101873.9,101680.7,101703.7,101635.3,101608.5,101339.3,101330.6,101381.2,101552.5,101566.6,101997.4,102322.3,102912.5,103113.6,103365.8,103485.1,null,null,null]}},"models_expected":["fuxi","persistence"],"models":{"fuxi":{"tp06":{"status":"ok","values":[0.012,0.012,0.027,0.101,0.076,0.03,0.023,0.019,0.018,0.016,0.02,0.039,0.03,0.098,0.108,0.06,0.03,0.005,0.008,0.012]},"t2m":{"status":"ok","values":[283.29,284.73,290.26,286.99,284.36,285.49,291.36,287.77,285.33,286.26,290.09,287.15,284.24,283.58,285.75,283.46,280.88,281.09,284.45,282.46]},"u10m":{"status":"ok","values":[-0.42,-1.35,-1.77,-2.99,-1.13,-0.6,-2.47,-4.12,-3.07,-3.19,-3.44,-3.47,-3.25,-3.88,-3.71,-4.17,-2.7,-2.79,-3.91,-4.06]},"v10m":{"status":"ok","values":[-3.68,-2.21,-1.88,0.07,-1.81,-0.55,0.22,-0.1,0.74,1.98,2.93,3.32,6.47,6.71,4.56,4.37,3.82,3.37,0.76,0.12]},"z500":{"status":"ok","values":[55498.2,55577.3,55376.7,55352.3,55118.9,55226.9,55140.4,55165.9,54998.5,54988.3,54771.0,54882.5,55017.0,55201.0,55272.0,55466.4,55447.7,55563.1,55544.3,55622.3]},"t850":{"status":"ok","values":[278.66,280.36,279.53,279.7,278.7,279.67,280.98,281.55,281.15,280.34,279.06,277.86,277.14,275.87,273.16,271.43,273.12,274.4,274.45,275.58]},"msl":{"status":"ok","values":[101854.3,101905.3,101655.0,101730.4,101655.8,101655.4,101378.3,101423.0,101372.8,101526.0,101548.5,101901.2,102296.7,102826.2,103018.5,103359.4,103483.1,103599.3,103333.2,103305.9]}},"persistence":{"tp06":{"status":"ok","native_variable":"tp","values":[0.0,0.0,0.0,0.0,0.0,0.0,0.0,0.0,0.0,0.0,0.0,0.0,0.0,0.0,0.0,0.0,0.0,0.0,0.0,0.0]},"t2m":{"status":"ok","values":[286.12,286.12,286.12,286.12,286.12,286.12,286.12,286.12,286.12,286.12,286.12,286.12,286.12,286.12,286.12,286.12,286.12,286.12,286.12,286.12]},"u10m":{"status":"ok","values":[-2.87,-2.87,-2.87,-2.87,-2.87,-2.87,-2.87,-2.87,-2.87,-2.87,-2.87,-2.87,-2.87,-2.87,-2.87,-2.87,-2.87,-2.87,-2.87,-2.87]},"v10m":{"status":"ok","values":[-2.03,-2.03,-2.03,-2.03,-2.03,-2.03,-2.03,-2.03,-2.03,-2.03,-2.03,-2.03,-2.03,-2.03,-2.03,-2.03,-2.03,-2.03,-2.03,-2.03]},"z500":{"status":"ok","values":[55570.5,55570.5,55570.5,55570.5,55570.5,55570.5,55570.5,55570.5,55570.5,55570.5,55570.5,55570.5,55570.5,55570.5,55570.5,55570.5,55570.5,55570.5,55570.5,55570.5]},"t850":{"status":"ok","values":[277.05,277.05,277.05,277.05,277.05,277.05,277.05,277.05,277.05,277.05,277.05,277.05,277.05,277.05,277.05,277.05,277.05,277.05,277.05,277.05]},"msl":{"status":"ok","values":[101888.0,101888.0,101888.0,101888.0,101888.0,101888.0,101888.0,101888.0,101888.0,101888.0,101888.0,101888.0,101888.0,101888.0,101888.0,101888.0,101888.0,101888.0,101888.0,101888.0]}}}}
