{"schema_version":1,"init_time":"2026-09-09T00:00:00Z","regime":"realtime","tier":"provisional","init_source":"gfs","truth_source":"gfs_analysis","truth_valid_through":"2026-09-14T00:00:00Z","city":{"id":"london","name":"London","lat":51.51,"lon":-0.13},"leads":[6,12,18,24,30,36,42,48,54,60,66,72,78,84,90,96,102,108,114,120],"valid_times":["2026-09-09T06:00:00Z","2026-09-09T12:00:00Z","2026-09-09T18:00:00Z","2026-09-10T00:00:00Z","2026-09-10T06:00:00Z","2026-09-10T12:00:00Z","2026-09-10T18:00:00Z","2026-09-11T00:00:00Z","2026-09-11T06:00:00Z","2026-09-11T12:00:00Z","2026-09-11T18:00:00Z","2026-09-12T00:00:00Z","2026-09-12T06:00:00Z","2026-09-12T12:00:00Z","2026-09-12T18:00:00Z","2026-09-13T00:00:00Z","2026-09-13T06:00:00Z","2026-09-13T12:00:00Z","2026-09-13T18:00:00Z","2026-09-14T00:00:00Z"],"truth":{"tp06":{"status":"truth_pending","values":null},"t2m":{"status":"ok","values":[285.06,291.34,290.23,288.73,286.97,292.9,291.17,289.7,288.98,294.16,292.9,290.57,287.02,292.73,294.0,291.23,291.08,292.12,292.85,291.3]},"u10m":{"status":"ok","values":[3.8,3.11,0.53,2.21,1.32,3.14,3.03,3.24,2.5,2.7,1.1,1.82,2.45,4.47,3.75,3.62,3.06,3.2,2.35,2.15]},"v10m":{"status":"ok","values":[-0.45,-2.03,-1.07,1.12,0.5,3.03,3.75,3.53,0.86,-1.17,-1.54,0.76,1.66,2.67,2.87,1.96,1.52,0.63,0.34,0.89]},"z500":{"status":"ok","values":[55092.0,55668.6,55813.5,55897.2,55913.2,56066.9,56069.4,55939.2,56145.7,56524.7,56834.3,57124.0,57220.0,57303.9,57196.0,57170.1,56836.4,56986.7,57325.4,57501.6]},"t850":{"status":"ok","values":[276.27,277.19,276.94,276.9,276.13,277.49,278.86,281.9,280.2,279.26,279.32,279.29,284.68,286.29,286.45,286.1,284.52,283.92,284.67,284.6]},"msl":{"status":"ok","values":[101450.3,101685.5,101770.6,101850.1,101765.4,101734.9,101556.8,101490.9,101641.2,101952.4,102170.4,102326.0,102272.0,102261.1,102105.1,102142.0,102051.0,102209.6,102143.3,102236.6]}},"models_expected":["fuxi","persistence"],"models":{"fuxi":{"tp06":{"status":"ok","values":[0.002,0.071,0.091,0.015,0.018,0.0,0.054,0.543,0.408,0.261,0.059,0.025,0.013,0.091,0.172,0.424,0.211,0.4,0.072,0.015]},"t2m":{"status":"ok","values":[285.4,292.06,290.86,285.73,284.25,292.74,291.31,290.09,289.44,294.51,293.75,287.86,286.02,294.36,293.74,292.28,292.15,296.03,294.89,290.28]},"u10m":{"status":"ok","values":[4.07,1.98,1.11,0.77,0.39,2.5,1.76,2.35,2.08,1.77,0.31,0.97,1.66,4.12,3.73,3.21,2.66,2.61,1.05,1.23]},"v10m":{"status":"ok","values":[-1.48,-2.06,0.12,0.95,1.92,3.94,4.61,4.54,0.66,-0.86,-0.35,0.44,1.97,4.07,3.14,2.38,1.18,-0.34,-0.07,0.31]},"z500":{"status":"ok","values":[55151.6,55761.1,55945.1,56078.7,56069.9,56209.2,56231.7,56096.1,56226.8,56519.1,56768.8,57141.1,57195.7,57209.5,57135.5,57049.7,56874.5,57128.4,57393.7,57611.6]},"t850":{"status":"ok","values":[277.32,276.71,277.35,277.11,277.64,277.33,278.98,281.02,281.04,279.79,279.66,280.51,284.28,284.96,285.3,285.02,284.02,282.66,282.27,284.32]},"msl":{"status":"ok","values":[101475.4,101753.6,101854.3,101921.6,101879.6,101808.3,101640.1,101590.6,101676.7,101965.6,102145.5,102329.2,102271.8,102187.5,102050.0,102050.3,102008.0,102136.4,102168.7,102307.3]}},"persistence":{"tp06":{"status":"ok","native_variable":"tp","values":[0.0,0.0,0.0,0.0,0.0,0.0,0.0,0.0,0.0,0.0,0.0,0.0,0.0,0.0,0.0,0.0,0.0,0.0,0.0,0.0]},"t2m":{"status":"ok","values":[286.34,286.34,286.34,286.34,286.34,286.34,286.34,286.34,286.34,286.34,286.34,286.34,286.34,286.34,286.34,286.34,286.34,286.34,286.34,286.34]},"u10m":{"status":"ok","values":[4.5,4.5,4.5,4.5,4.5,4.5,4.5,4.5,4.5,4.5,4.5,4.5,4.5,4.5,4.5,4.5,4.5,4.5,4.5,4.5]},"v10m":{"status":"ok","values":[-0.18,-0.18,-0.18,-0.18,-0.18,-0.18,-0.18,-0.18,-0.18,-0.18,-0.18,-0.18,-0.18,-0.18,-0.18,-0.18,-0.18,-0.18,-0.18,-0.18]},"z500":{"status":"ok","values":[54906.2,54906.2,54906.2,54906.2,54906.2,54906.2,54906.2,54906.2,54906.2,54906.2,54906.2,54906.2,54906.2,54906.2,54906.2,54906.2,54906.2,54906.2,54906.2,54906.2]},"t850":{"status":"ok","values":[277.69,277.69,277.69,277.69,277.69,277.69,277.69,277.69,277.69,277.69,277.69,277.69,277.69,277.69,277.69,277.69,277.69,277.69,277.69,277.69]},"msl":{"status":"ok","values":[101170.4,101170.4,101170.4,101170.4,101170.4,101170.4,101170.4,101170.4,101170.4,101170.4,101170.4,101170.4,101170.4,101170.4,101170.4,101170.4,101170.4,101170.4,101170.4,101170.4]}}}}
